{
  "config_version": "1.0.0",
  "document_id": "MAN-SKMAGIC-WPU-JAC104D-JCC104D-REV00",
  "exact_sales_code": "WPUJAC104DWH",
  "chunks": [
    {
      "chunk_id": "RAG-WPUJAC104DWH-NO-WATER-001",
      "evidence_id": "EVD-WPUJAC104DWH-NO-WATER-001",
      "document_id": "MAN-SKMAGIC-WPU-JAC104D-JCC104D-REV00",
      "source_page_ids": [
        "MAN-SKMAGIC-WPU-JAC104D-JCC104D-REV00-P037"
      ],
      "source_type": "official_manual",
      "provider": "SK매직",
      "exact_sales_code": "WPUJAC104DWH",
      "product_model": "WPU-JAC104 (D) / WPU-JCC104 (D)",
      "model_family": "WPU-JAC104",
      "product_generation": "D",
      "scope_role": "mvp",
      "version": "REV.00",
      "page_start": 37,
      "page_end": 37,
      "page_refs": [
        37
      ],
      "section_title": "고장 신고 전 확인하기",
      "topic_code": "symptom_no_water",
      "symptom_category": "NO_WATER",
      "risk_level": "caution",
      "use_guidance": "PARTIAL_STOP",
      "requires_consultation": true,
      "applicability": "MODEL_EXACT",
      "chunk_text": "물이 출수되지 않으면 필터 교체 주기를 확인합니다. 필터 교체 후에도 출수되지 않으면 원수 밸브를 잠그고 전원 플러그를 뽑은 후 고객상담센터에 연락합니다. 수돗물 단수 시에는 원수 밸브를 잠그고 전원 플러그를 뽑으며, 수돗물이 다시 나오면 원수 밸브를 열고 전원 플러그를 꽂습니다. 연결 호스가 꺾였는지도 확인합니다.",
      "evidence_summary": "무출수 원인을 필터 수명, 단수, 연결 호스 꺾임으로 구분하고 조건별 안전 조치와 상담 전환을 안내합니다.",
      "safe_actions": [
        "필터 교체 주기를 확인합니다.",
        "단수 중에는 원수 밸브를 잠그고 전원 플러그를 뽑습니다.",
        "연결 호스에 꺾인 부분이 있는지 확인합니다."
      ],
      "escalation_conditions": [
        "필터 교체 후에도 출수되지 않으면 원수 밸브를 잠그고 전원 플러그를 뽑은 뒤 고객상담센터에 연락합니다."
      ],
      "prohibited_actions": [
        "필터 교체 후에도 출수되지 않는 상태에서 원수 밸브와 전원을 켠 채 계속 사용하지 않습니다."
      ],
      "source_url": "https://www.skintellixservice.com/web/easy/easyMain.do?inputBasicKeyword=WPUJAC104DWH&tabIndex=3",
      "source_file_sha256": "0C6B94AF53F23211F5FE542CB7712109E4A769A6F42ED758DA7792FC62E44B2C",
      "verification_status": "TEXT_AND_VISUAL_VERIFIED",
      "generated_at": "${generated_at}"
    },
    {
      "chunk_id": "RAG-WPUJAC104DWH-COLD-TEMPERATURE-001",
      "evidence_id": "EVD-WPUJAC104DWH-COLD-TEMPERATURE-001",
      "document_id": "MAN-SKMAGIC-WPU-JAC104D-JCC104D-REV00",
      "source_page_ids": [
        "MAN-SKMAGIC-WPU-JAC104D-JCC104D-REV00-P037"
      ],
      "source_type": "official_manual",
      "provider": "SK매직",
      "exact_sales_code": "WPUJAC104DWH",
      "product_model": "WPU-JAC104 (D) / WPU-JCC104 (D)",
      "model_family": "WPU-JAC104",
      "product_generation": "D",
      "scope_role": "mvp",
      "version": "REV.00",
      "page_start": 37,
      "page_end": 37,
      "page_refs": [
        37
      ],
      "section_title": "고장 신고 전 확인하기",
      "topic_code": "symptom_cold_temperature",
      "symptom_category": "COLD_WATER_NOT_COLD",
      "risk_level": "general",
      "use_guidance": "NORMAL",
      "requires_consultation": true,
      "applicability": "MODEL_EXACT",
      "chunk_text": "냉수가 차갑지 않을 때 연속적으로 많은 양을 출수했다면 잠시 후 다시 출수합니다. 냉수 잠금 기능을 해제하고 방열팬 먼지 필터의 먼지를 확인해 청소합니다. 전원이 정상 공급되는 상태에서 2시간 뒤에도 냉수가 차갑지 않으면 고객상담센터에 연락합니다.",
      "evidence_summary": "다량 출수, 냉수 기능 꺼짐, 방열팬 먼지와 냉각부 고장을 순서대로 구분합니다.",
      "safe_actions": [
        "연속 다량 출수 후에는 잠시 기다렸다가 다시 출수합니다.",
        "냉수 잠금 기능을 해제합니다.",
        "방열팬 먼지 필터를 확인하고 청소합니다."
      ],
      "escalation_conditions": [
        "전원이 정상인데 2시간 뒤에도 냉수가 차갑지 않으면 고객상담센터에 연락합니다."
      ],
      "prohibited_actions": [
        "2시간 뒤에도 차갑지 않은 상태를 정상으로 단정해 안내하지 않습니다."
      ],
      "source_url": "https://www.skintellixservice.com/web/easy/easyMain.do?inputBasicKeyword=WPUJAC104DWH&tabIndex=3",
      "source_file_sha256": "0C6B94AF53F23211F5FE542CB7712109E4A769A6F42ED758DA7792FC62E44B2C",
      "verification_status": "TEXT_AND_VISUAL_VERIFIED",
      "generated_at": "${generated_at}"
    },
    {
      "chunk_id": "RAG-WPUJAC104DWH-NOISE-001",
      "evidence_id": "EVD-WPUJAC104DWH-NOISE-001",
      "document_id": "MAN-SKMAGIC-WPU-JAC104D-JCC104D-REV00",
      "source_page_ids": [
        "MAN-SKMAGIC-WPU-JAC104D-JCC104D-REV00-P037"
      ],
      "source_type": "official_manual",
      "provider": "SK매직",
      "exact_sales_code": "WPUJAC104DWH",
      "product_model": "WPU-JAC104 (D) / WPU-JCC104 (D)",
      "model_family": "WPU-JAC104",
      "product_generation": "D",
      "scope_role": "mvp",
      "version": "REV.00",
      "page_start": 37,
      "page_end": 37,
      "page_refs": [
        37
      ],
      "section_title": "고장 신고 전 확인하기",
      "topic_code": "symptom_noise",
      "symptom_category": "NOISE",
      "risk_level": "general",
      "use_guidance": "NORMAL",
      "requires_consultation": true,
      "applicability": "MODEL_EXACT",
      "chunk_text": "윙 소리는 방열팬 동작 소리이며 출수 중 툭 소리는 밸브 작동 소리입니다. 컴프레서 때문에 냉장고와 유사한 소음이 있을 수 있고, 열교환 탱크의 냉각수가 회전하며 물 흐르는 소리가 날 수 있습니다. 소음이 너무 크면 고객상담센터에 연락합니다.",
      "evidence_summary": "방열팬, 밸브, 컴프레서, 열교환 탱크에서 발생하는 정상 작동음을 설명하고 과도한 소음은 상담으로 전환합니다.",
      "safe_actions": [
        "윙, 툭, 냉장고 유사음, 내부 물 흐름 소리인지 구분합니다."
      ],
      "escalation_conditions": [
        "방열팬 또는 물 흐름 소리가 너무 크면 고객상담센터에 연락합니다."
      ],
      "prohibited_actions": [
        "소리가 너무 큰데도 모든 소음을 정상 작동음으로 단정하지 않습니다."
      ],
      "source_url": "https://www.skintellixservice.com/web/easy/easyMain.do?inputBasicKeyword=WPUJAC104DWH&tabIndex=3",
      "source_file_sha256": "0C6B94AF53F23211F5FE542CB7712109E4A769A6F42ED758DA7792FC62E44B2C",
      "verification_status": "TEXT_AND_VISUAL_VERIFIED",
      "generated_at": "${generated_at}"
    },
    {
      "chunk_id": "RAG-WPUJAC104DWH-LEAK-001",
      "evidence_id": "EVD-WPUJAC104DWH-LEAK-001",
      "document_id": "MAN-SKMAGIC-WPU-JAC104D-JCC104D-REV00",
      "source_page_ids": [
        "MAN-SKMAGIC-WPU-JAC104D-JCC104D-REV00-P038"
      ],
      "source_type": "official_manual",
      "provider": "SK매직",
      "exact_sales_code": "WPUJAC104DWH",
      "product_model": "WPU-JAC104 (D) / WPU-JCC104 (D)",
      "model_family": "WPU-JAC104",
      "product_generation": "D",
      "scope_role": "mvp",
      "version": "REV.00",
      "page_start": 38,
      "page_end": 38,
      "page_refs": [
        38
      ],
      "section_title": "고장 신고 전 확인하기",
      "topic_code": "symptom_leak",
      "symptom_category": "LEAK",
      "risk_level": "danger",
      "use_guidance": "TOTAL_STOP",
      "requires_consultation": true,
      "applicability": "MODEL_EXACT",
      "chunk_text": "제품 누수는 조립 또는 연결 부위 불량 가능성이 있습니다. 즉시 원수 밸브를 잠그고 전원 플러그를 뽑은 후 고객상담센터에 연락합니다.",
      "evidence_summary": "누수 발생 시 급수와 전원을 차단하고 즉시 상담으로 전환하는 안전 우선 조치입니다.",
      "safe_actions": [
        "원수 밸브를 잠급니다.",
        "전원 플러그를 뽑습니다.",
        "고객상담센터에 연락합니다."
      ],
      "escalation_conditions": [
        "제품 누수가 발생하면 즉시 상담으로 전환합니다."
      ],
      "prohibited_actions": [
        "누수 상태에서 원수 밸브와 전원을 켠 채 제품을 사용하지 않습니다."
      ],
      "source_url": "https://www.skintellixservice.com/web/easy/easyMain.do?inputBasicKeyword=WPUJAC104DWH&tabIndex=3",
      "source_file_sha256": "0C6B94AF53F23211F5FE542CB7712109E4A769A6F42ED758DA7792FC62E44B2C",
      "verification_status": "TEXT_AND_VISUAL_VERIFIED",
      "generated_at": "${generated_at}"
    },
    {
      "chunk_id": "RAG-WPUJAC104DWH-TASTE-ODOR-001",
      "evidence_id": "EVD-WPUJAC104DWH-TASTE-ODOR-001",
      "document_id": "MAN-SKMAGIC-WPU-JAC104D-JCC104D-REV00",
      "source_page_ids": [
        "MAN-SKMAGIC-WPU-JAC104D-JCC104D-REV00-P038"
      ],
      "source_type": "official_manual",
      "provider": "SK매직",
      "exact_sales_code": "WPUJAC104DWH",
      "product_model": "WPU-JAC104 (D) / WPU-JCC104 (D)",
      "model_family": "WPU-JAC104",
      "product_generation": "D",
      "scope_role": "mvp",
      "version": "REV.00",
      "page_start": 38,
      "page_end": 38,
      "page_refs": [
        38
      ],
      "section_title": "고장 신고 전 확인하기",
      "topic_code": "symptom_taste_odor",
      "symptom_category": "TASTE_ODOR",
      "risk_level": "caution",
      "use_guidance": "PARTIAL_STOP",
      "requires_consultation": true,
      "applicability": "MODEL_EXACT",
      "chunk_text": "불쾌한 맛과 냄새가 발생했을 때 10일 이내 부재였다면 냉수, 정수, 온수를 각각 1L씩 1회 이상 출수해 버린 후 사용합니다. 10일 이상 부재였다면 필요 시 고객상담센터에 점검을 요구합니다. 부적합한 장소에 설치했거나 장시간 사용하지 않았다면 필터를 모두 교체한 후 사용합니다.",
      "evidence_summary": "장기 부재 기간과 설치·미사용 조건에 따라 통수, 상담 점검, 필터 교체를 구분합니다.",
      "safe_actions": [
        "10일 이내 부재 후 냉수, 정수, 온수를 각각 1L 이상 버립니다.",
        "부적합 장소 또는 장시간 미사용이면 필터를 모두 교체합니다."
      ],
      "escalation_conditions": [
        "10일 이상 부재한 경우 필요 시 고객상담센터에 점검을 요청합니다."
      ],
      "prohibited_actions": [
        "장기 미사용 후 필요한 통수나 점검 없이 바로 음용하지 않습니다."
      ],
      "source_url": "https://www.skintellixservice.com/web/easy/easyMain.do?inputBasicKeyword=WPUJAC104DWH&tabIndex=3",
      "source_file_sha256": "0C6B94AF53F23211F5FE542CB7712109E4A769A6F42ED758DA7792FC62E44B2C",
      "verification_status": "TEXT_AND_VISUAL_VERIFIED",
      "generated_at": "${generated_at}"
    },
    {
      "chunk_id": "RAG-WPUJAC104DWH-LOW-FLOW-001",
      "evidence_id": "EVD-WPUJAC104DWH-LOW-FLOW-001",
      "document_id": "MAN-SKMAGIC-WPU-JAC104D-JCC104D-REV00",
      "source_page_ids": [
        "MAN-SKMAGIC-WPU-JAC104D-JCC104D-REV00-P038"
      ],
      "source_type": "official_manual",
      "provider": "SK매직",
      "exact_sales_code": "WPUJAC104DWH",
      "product_model": "WPU-JAC104 (D) / WPU-JCC104 (D)",
      "model_family": "WPU-JAC104",
      "product_generation": "D",
      "scope_role": "mvp",
      "version": "REV.00",
      "page_start": 38,
      "page_end": 38,
      "page_refs": [
        38
      ],
      "section_title": "고장 신고 전 확인하기",
      "topic_code": "symptom_low_flow",
      "symptom_category": "LOW_FLOW",
      "risk_level": "general",
      "use_guidance": "NORMAL",
      "requires_consultation": true,
      "applicability": "MODEL_EXACT",